{
  "request_id": "8b84c421-2a3f-4971-bb4b-e85946b8c200",
  "session_id": "39664dce-f233-4fd5-a2bc-5963e70661b9",
  "passage_id": "wednesday_plum",
  "events": [
    {
      "event_id": "23e88ee2-1386-4632-90bb-051b2ace8a77",
      "passage_id": "tuesday_pear",
      "target_letter": "P",
      "response": "incorrect"
    }
  ],
  "current_passage": {
    "summary": "The teacher reads the plum passage from their own book.",
    "word": "plum",
    "letter": "P"
  },
  "upcoming_opportunities": [],
  "learner_history": {
    "synthetic": true,
    "A": "familiar",
    "P": "needs_practice"
  },
  "available_props": [
    "apple",
    "pear",
    "plum"
  ],
  "props_source": "teacher-supplied test data; not camera observations"
}
